### ISSUE TITLE
[Bug] 

### ISSUE THREAD

**Issue by Sam-Hamma** [thingsboard/thingsboard#5130]
**Describe the bug**
Client is connected but can't see telemetry data.

**Your Server Environment**
* own setup
  * AWS EC2 1cpu, 1gb Ram
  * ThingsBoard Version 3.3
  * OS Name and Version ubuntu 20.04

**Your Device**

* Connectivity
  * MQTTS with self signed certificates (but also with token / username)
* Device vendor and model
  * Simulated device (node)
  * Simulated device (mosquitto_pub)

**To Reproduce**
1. Install thingsboard following [the guide](https://thingsboard.io/docs/user-guide/install/aws/) for AWS EC2.
2. Configure device (credentials, rule chain etc.)
3. Launch device
4. Can't see any errors on logs, device seems to be connected (in server logs and on device logs)

**Expected behavior**
See telemetry data.

**Screenshots**
![tcpdump (port 8883)](https://user-images.githubusercontent.com/84706100/130427250-2340d659-496a-450b-b540-095b2b8070c9.png)
![Device is connected](https://user-images.githubusercontent.com/84706100/130427398-9bfe70d8-b74a-4115-aba1-bfa54536f0c8.png)
![Postgres ts_kv table](https://user-images.githubusercontent.com/84706100/130428077-3b31bd9c-bce1-4fb7-99e9-783811253da9.png)

**Additional context**
- Using v3.3.deb package (no docker, no nginx proxy), with a local postgres install.
- Necessary ports are open
- Tried using a simple token auth (port 1883)
- Tried launching the device locally on the EC2 instance
- Tried logging _*input*_ rule chain node directly: no logs (on a local machine where everything works as expected, I can see the logs)

**Comment by Sam-Hamma** [comment]
Here's the output of `tcpdump -nnSX port 1883 -i eth0` on the EC2 instance (using tokens instead of TLS: message is not encrypted).
```
12:27:27.744867 IP x.x.x.x.1883 > x.x.x.x.39360: Flags [.], ack 3974905548, win 442, options [nop,nop,TS val 921129801 ecr 2390786782], length 0
        0x0000:  4500 0034 de57 4000 4006 f5d0 ac1f 25e5  E..4.W@.@.....%.
        0x0010:  c500 cf96 075b 99c0 4b4e af63 ecec 3ecc  .....[..KN.c..>.
        0x0020:  8010 01ba 66c2 0000 0101 080a 36e7 5349  ....f.......6.SI
        0x0030:  8e80 82de                                ....
12:27:30.745538 IP x.x.x.x.39360 > x.x.x.x.1883: Flags [P.], seq 3974905548:3974905698, ack 1263447907, win 502, options [nop,nop,TS val 2390789783 ecr 921129801], length 150
        0x0000:  4500 00ca e8d5 4000 2706 03bd c500 cf96  E.....@.'.......
        0x0010:  ac1f 25e5 99c0 075b ecec 3ecc 4b4e af63  ..%....[..>.KN.c
        0x0020:  8018 01f6 b503 0000 0101 080a 8e80 8e97  ................
        0x0030:  36e7 5349 3093 0100 1776 312f 6465 7669  6.SI0....v1/devi
        0x0040:  6365 732f 6d65 2f74 656c 656d 6574 7279  ces/me/telemetry
        0x0050:  7b22 7374 6174 6522 3a66 616c 7365 2c22  {"state":false,"
        0x0060:  6c75 6d69 6e6f 7369 7479 223a 3734 352e  luminosity":745.
        0x0070:  3736 2c22 6c6f 6e67 6974 7564 6522 3a31  76,"longitude":1
        0x0080:  2e38 3830 3031 3935 3939 3436 3138 3637  .880019599461867
        0x0090:  312c 226c 6174 6974 7564 6522 3a34 382e  1,"latitude":48.
        0x00a0:  3430 3030 3139 3034 3632 3937 3534 342c  400019046297544,
        0x00b0:  2274 696d 6573 7461 6d70 223a 3136 3239  "timestamp":1629
        0x00c0:  3839 3434 3530 3731 327d                 894450712}
12:27:30.745552 IP x.x.x.x.1883 > x.x.x.x.39360: Flags [.], ack 3974905698, win 442, options [nop,nop,TS val 921132802 ecr 2390789783], length 0
        0x0000:  4500 0034 de58 4000 4006 f5cf ac1f 25e5  E..4.X@.@.....%.
        0x0010:  c500 cf96 075b 99c0 4b4e af63 ecec 3f62  .....[..KN.c..?b
        0x0020:  8010 01ba 66c2 0000 0101 080a 36e7 5f02  ....f.......6._.
        0x0030:  8e80 8e97                                ....
```
Obfuscating IPs (using `x.x.x.x` instead)
The topics are checked to be the same (default ones) both on my simulator code as well as on the _Device Profile_ I am using (**default** profile + custom profile).
